{
  "agent": "debris-designer",
  "size_classes": {
    "small": {
      "slots_crushed": 1,
      "slots_uncrushed": 1,
      "hand_tetherable": true
    },
    "medium": {
      "slots_crushed": 1,
      "slots_uncrushed": 1,
      "hand_tetherable": true
    },
    "oversized": {
      "slots_crushed": 1,
      "slots_uncrushed": 1,
      "hand_tetherable": false
    }
  },
  "debris": [
    {
      "id": "scorched_hull_panel",
      "display_name": "Scorched Hull Panel",
      "altitude_m": 52000,
      "size_class": "small",
      "fragile": false,
      "mass_kg": 62.15,
      "spawn_weight": 12,
      "notes": "A curved sheet of blackened skin off some anonymous bus, light enough that a half-empty jetpack can still bring one home."
    },
    {
      "id": "bent_truss_section",
      "display_name": "Bent Truss Section",
      "altitude_m": 58000,
      "size_class": "medium",
      "fragile": false,
      "mass_kg": 90.75,
      "spawn_weight": 11,
      "notes": "Aluminium lattice folded like a beer can; the first piece that teaches the player a slot is cheap and the mass in it is not."
    },
    {
      "id": "cracked_solar_array",
      "display_name": "Cracked Solar Array",
      "altitude_m": 63000,
      "size_class": "medium",
      "fragile": true,
      "mass_kg": 74.25,
      "spawn_weight": 4,
      "notes": "Cells still bright under the fracture lines — the cheap early lesson that some junk will not survive a hot pass or a hard flare."
    },
    {
      "id": "dented_fuel_bladder",
      "display_name": "Dented Fuel Bladder",
      "altitude_m": 71000,
      "size_class": "small",
      "fragile": false,
      "mass_kg": 107.25,
      "spawn_weight": 10,
      "notes": "A collapsed hydrazine bag with the plumbing still attached; dense for its size, so it rewards a player who reads mass and not silhouette."
    },
    {
      "id": "foil_insulation_bale",
      "display_name": "Foil Insulation Bale",
      "altitude_m": 79000,
      "size_class": "small",
      "fragile": false,
      "mass_kg": 99,
      "spawn_weight": 9,
      "notes": "Wadded multilayer blanket wound into a bale by its own tether stub — the most common thing floating at the bottom of the envelope."
    },
    {
      "id": "collapsed_antenna_dish",
      "display_name": "Collapsed Antenna Dish",
      "altitude_m": 88000,
      "size_class": "oversized",
      "fragile": false,
      "mass_kg": 165,
      "spawn_weight": 3,
      "notes": "A folded mesh reflector wider than the ship — bulk, not weight, is what puts it out of the hand magnet's reach; crane cable only."
    },
    {
      "id": "reaction_wheel_housing",
      "display_name": "Reaction Wheel Housing",
      "altitude_m": 97000,
      "size_class": "small",
      "fragile": false,
      "mass_kg": 181.5,
      "spawn_weight": 8,
      "notes": "A machined steel drum with the rotor seized inside; one slot for a mass that fights the jetpack the whole way back."
    },
    {
      "id": "snapped_boom_arm",
      "display_name": "Snapped Boom Arm",
      "altitude_m": 108000,
      "size_class": "medium",
      "fragile": false,
      "mass_kg": 173.25,
      "spawn_weight": 8,
      "notes": "Instrument boom sheared at the hinge, trailing its own cable loom — the workhorse haul of the upper starter runs."
    },
    {
      "id": "shattered_camera_mast",
      "display_name": "Shattered Camera Mast",
      "altitude_m": 118000,
      "size_class": "medium",
      "fragile": true,
      "mass_kg": 156.75,
      "spawn_weight": 4,
      "notes": "Optics head still bolted to a splintered mast; worth the reach, but it will not forgive a late chute."
    },
    {
      "id": "battery_pallet",
      "display_name": "Battery Pallet",
      "altitude_m": 124000,
      "size_class": "small",
      "fragile": false,
      "mass_kg": 214.5,
      "spawn_weight": 7,
      "notes": "Four cells strapped to a frame, the heaviest thing in the lower envelope — the cliff-edge grab of a starter hop."
    },
    {
      "id": "torn_radiator_panel",
      "display_name": "Torn Radiator Panel",
      "altitude_m": 132000,
      "size_class": "medium",
      "fragile": true,
      "mass_kg": 214.5,
      "spawn_weight": 4,
      "notes": "Ammonia loop opened to vacuum and frozen solid; the fins buckle if you look at them, and heat finishes what the tear started."
    },
    {
      "id": "cryo_tank_girdle",
      "display_name": "Cryo Tank Girdle",
      "altitude_m": 141000,
      "size_class": "medium",
      "fragile": false,
      "mass_kg": 264,
      "spawn_weight": 8,
      "notes": "The ribbed midsection of a burst cryogenic tank — solid, stackable, and the reliable backbone of a mid-envelope haul."
    },
    {
      "id": "gyro_package",
      "display_name": "Gyro Package",
      "altitude_m": 149000,
      "size_class": "small",
      "fragile": false,
      "mass_kg": 288.75,
      "spawn_weight": 7,
      "notes": "A sealed inertial unit the size of a toolbox and the weight of a person; the densest single-slot buy in the middle third."
    },
    {
      "id": "docking_collar",
      "display_name": "Docking Collar",
      "altitude_m": 157000,
      "size_class": "medium",
      "fragile": false,
      "mass_kg": 313.5,
      "spawn_weight": 7,
      "notes": "Forged ring with the latches sheared off, still true enough to sell; nothing this far up is light, and this is what that feels like."
    },
    {
      "id": "buckled_truss_node",
      "display_name": "Buckled Truss Node",
      "altitude_m": 166000,
      "size_class": "medium",
      "fragile": false,
      "mass_kg": 330,
      "spawn_weight": 7,
      "notes": "Six-way structural junction from a station keel — the same shape as the starter truss, four times the mass, which is the whole gradient in one sprite."
    },
    {
      "id": "optics_bench",
      "display_name": "Optics Bench",
      "altitude_m": 175000,
      "size_class": "medium",
      "fragile": true,
      "mass_kg": 305.25,
      "spawn_weight": 4,
      "notes": "Invar slab with the mirrors still mounted; heavy and delicate at once — the piece that makes a full hold a bad idea."
    },
    {
      "id": "deployable_mast_cassette",
      "display_name": "Deployable Mast Cassette",
      "altitude_m": 186000,
      "size_class": "oversized",
      "fragile": false,
      "mass_kg": 429,
      "spawn_weight": 2,
      "notes": "A coilable mast half-extended and jammed, thirty metres of it hanging out of the drum; crane cable only, and no hand magnet will ever move it."
    },
    {
      "id": "ion_thruster_cluster",
      "display_name": "Ion Thruster Cluster",
      "altitude_m": 196000,
      "size_class": "small",
      "fragile": false,
      "mass_kg": 412.5,
      "spawn_weight": 6,
      "notes": "Four grid engines on a common mount, magnets and rare metals throughout — one slot, and it tows like an anchor."
    },
    {
      "id": "cracked_pressure_dome",
      "display_name": "Cracked Pressure Dome",
      "altitude_m": 209000,
      "size_class": "medium",
      "fragile": true,
      "mass_kg": 510,
      "spawn_weight": 3,
      "notes": "The end cap of a habitat module, split along a weld; the first genuinely dangerous grab of the top third."
    },
    {
      "id": "reactor_shield_plug",
      "display_name": "Reactor Shield Plug",
      "altitude_m": 220000,
      "size_class": "small",
      "fragile": false,
      "mass_kg": 680,
      "spawn_weight": 6,
      "notes": "A tungsten-loaded slug off a dead power unit — the smallest thing up here and the one most likely to end the ride home badly."
    },
    {
      "id": "comsat_bus_frame",
      "display_name": "Comsat Bus Frame",
      "altitude_m": 232000,
      "size_class": "medium",
      "fragile": false,
      "mass_kg": 840,
      "spawn_weight": 8,
      "notes": "The structural core of a big geostationary bird, still hung with propellant lines; the staple haul for a maxed hold near the ceiling."
    },
    {
      "id": "telescope_mirror_segment",
      "display_name": "Telescope Mirror Segment",
      "altitude_m": 244000,
      "size_class": "medium",
      "fragile": true,
      "mass_kg": 930,
      "spawn_weight": 2,
      "notes": "A hexagon of coated beryllium, unmarked and irreplaceable — the payout of the run if it lands, dead weight in the hold if it does not."
    },
    {
      "id": "isotope_cask",
      "display_name": "Isotope Cask",
      "altitude_m": 255000,
      "size_class": "small",
      "fragile": false,
      "mass_kg": 1220,
      "spawn_weight": 5,
      "notes": "Sealed transport cask off an RTG, all shielding and no volume; the heaviest piece in the catalog a pilot can tether without gambling on fragility."
    },
    {
      "id": "solar_wing_spine",
      "display_name": "Solar Wing Spine",
      "altitude_m": 266000,
      "size_class": "oversized",
      "fragile": false,
      "mass_kg": 1500,
      "spawn_weight": 2,
      "notes": "The full hinged spine of a station array with the panels still folded along it; crane cable only, so it hangs there as a promise the shipping slice cannot cash."
    },
    {
      "id": "scorched_reentry_cone",
      "display_name": "Scorched Reentry Cone",
      "altitude_m": 276000,
      "size_class": "medium",
      "fragile": true,
      "mass_kg": 1600,
      "spawn_weight": 2,
      "notes": "Somebody else's nose cone that never made it down, ablator half-eaten; the heaviest thing in the catalog and the heaviest a hand magnet can take, parked where the module glints."
    }
  ],
  "band_summary": [
    {
      "sample": "bottom",
      "altitude_m": 88333,
      "piece_count": 10,
      "fragile_fraction": 0.105,
      "mean_mass_kg": 132.44
    },
    {
      "sample": "middle",
      "altitude_m": 165000,
      "piece_count": 8,
      "fragile_fraction": 0.178,
      "mean_mass_kg": 319.69
    },
    {
      "sample": "top",
      "altitude_m": 241667,
      "piece_count": 7,